[
  {
    "id": 139,
    "title": "Toy Tease",
    "image": "https://imagecdn.clips4sale.com/accounts99/135731/clip_images/previewlg_32491557.jpg",
    "date": "12/10/25",
    "dateISO": "2025-12-10",
    "category": "Ssbbw",
    "keywords": "Toy,Tease,Bathroom",
    "duration": "11 Min",
    "description": "You're hungrily taking in my luxurious body that's bursting out of my barely-there bikini. Playing with my dildo, I tease my nipples, slip it between my rolls, and fuck my deep belly button.",
    "watchUrl": "https://1drv.ms/v/c/56a0c4f446943249/IQSlELMQV81LTq8WbqZywRT5ASz0X9lTQdzoW_PqLZe8NWo"
  },
  {
    "id": 138,
    "title": "Weigh In August 2025",
    "image": "https://imagecdn.clips4sale.com/accounts99/135731/clip_images/previewlg_31780923.jpg",
    "date": "8/28/25",
    "dateISO": "2025-08-28",
    "category": "Ssbbw",
    "keywords": "Weigh-in,Weigh In,Weighing,Weight,Scale",
    "duration": "11 Min",
    "description": "It's that time again! Did my weight go up, stay the same? Watch me talk about my body, it's changes, how good my fat feels, and find out exactly what I weigh!",
    "watchUrl": "https://1drv.ms/v/c/56a0c4f446943249/IQRKLOEx6V4OQ6RzeALRiXu8AVQYj5Trjcw2yLlYrwQI-SQ"
  },
  {
    "id": 137,
    "title": "Tight Cherry Lingerie",
    "image": "https://imagecdn.clips4sale.com/accounts99/135731/clip_images/previewlg_31134889.jpg",
    "date": "5/16/25",
    "dateISO": "2025-05-16",
    "category": "Ssbbw",
    "keywords": "Tight,Tight Clothes,Cherry,Squeeze",
    "duration": "11 Min",
    "description": "Despite buying the biggest size available, this super tight cherry lingerie was still snug enough to barely squeeze my sumptuous rolls into. I am just destined to spill out of anything I put on, until eventually I can't wear any clothes at all!",
    "watchUrl": "https://1drv.ms/v/c/56a0c4f446943249/IQSenV1pgnCcS6m45CdTGQ-3Adc3UJwY46q9Q9YiY09b7oQ?"
  },
  {
    "id": 136,
    "title": "Blueberry Surprise Muffins",
    "image": "https://imagecdn.clips4sale.com/accounts99/135731/clip_images/previewlg_30895921.jpg",
    "date": "4/9/25",
    "dateISO": "2025-04-09",
    "category": "Ssbbw",
    "keywords": "Fat Rolls,Weight,Weight Gain,Blueberry,Inflate,Inflation,Eating,Expanding",
    "duration": "10 Min",
    "description": "Someone seems to have left out some delicious blueberry muffins, so obviously they must be for me! But these muffins must be a little different, because the more I eat, the more turned on I get, and the tighter my clothes feel. Am I... getting bigger?! It feels soooo good!",
    "watchUrl": "https://1drv.ms/v/c/56a0c4f446943249/IQRWQNn1Zet4Tbe0ZZaFrai-AYrmDO66Y54M7zMAZYw01v4?"
  },
  {
    "id": 135,
    "title": "Domestic Cutie Shaking Booty",
    "image": "https://imagecdn.clips4sale.com/accounts99/135731/clip_images/previewlg_30482805.jpg",
    "date": "1/29/25",
    "dateISO": "2025-01-29",
    "category": "Ssbbw",
    "keywords": "Domestic Goddess,Domestic,Goddess,Ass,Butt,Bounce",
    "duration": "10 Min",
    "description": "Even the most simple domestic tasks are made easier with a seat, but there's no way I can stop the urge to get up and bounce my massive booty when I know you're watching. I'm cleaning up, and getting a little dirty at the same time while I slowly show off more and more of my beautiful body.",
    "watchUrl": "https://1drv.ms/v/c/56a0c4f446943249/IQSTUjkqWBGtR5j7APjK_GjcAbPm9czvHbsrQCYsPU_Vdj0"
  },
  {
    "id": 134,
    "title": "Squeeze Into Jeans",
    "image": "https://imagecdn.clips4sale.com/accounts99/135731/clip_images/previewlg_30142751.jpg",
    "date": "11/28/24",
    "dateISO": "2024-11-28",
    "category": "Ssbbw",
    "keywords": "Jean,Jeans,Try On,Try-on,Squeeze",
    "duration": "12 Min",
    "description": "My new jeans have arrived and it's time to find out if these will fit, or end up in the return bin. I'm the fattest I've ever been, but these claim to be ultra stretchy. Join me while I to pull, squeeze, and wiggle my way into these jeans.",
    "watchUrl": "https://1drv.ms/v/c/56a0c4f446943249/IQQ0EPajXwCwQapxGE32mZPpAbb1A_aTMky2GxlLaxwSbdM"
  },
  {
    "id": 133,
    "title": "Pudgy Pedals",
    "image": "https://imagecdn.clips4sale.com/accounts99/135731/clip_images/previewlg_29981235.jpg",
    "date": "10/29/24",
    "dateISO": "2024-10-29",
    "category": "Ssbbw",
    "keywords": "Fat Rolls,Rolls,Weight Gain,Exercising,Out Of Shape,Lazy",
    "duration": "12 Min",
    "description": "You would thinking that pedaling wouldn't be hard, but when you're as massive as I am, it takes a lot more effort! Lifting these big legs isn't easy, so it is always important to finish any exercise with a yummy treat.",
    "watchUrl": "https://1drv.ms/v/c/56a0c4f446943249/IQSZxRBt1omURIQYJNtTozzxAc6nFd0CITekbRS2GgHqRh8"
  },
  {
    "id": 132,
    "title": "Weigh-In Sept 2024",
    "image": "https://imagecdn.clips4sale.com/accounts99/135731/clip_images/previewlg_29768629.jpg",
    "date": "9/18/24",
    "dateISO": "2024-09-18",
    "category": "Ssbbw",
    "keywords": "Scale,Weight,Weight Gain,Weigh In,Weigh-in,Gaining",
    "duration": "11 Min",
    "description": "I start off by trying on some pants that I have serious doubts about fitting, then weigh myself to see what the scale says after my Fat Girl Summer.",
    "watchUrl": "https://1drv.ms/v/c/56a0c4f446943249/IQQJvGrU_HwGR7cvyjV_Wpw_ASN4iv0HC_PyRO3bcPxwiKY"
  },
  {
    "id": 131,
    "title": "Weight Bunch Hump",
    "image": "https://imagecdn.clips4sale.com/accounts99/135731/clip_images/previewlg_29643109.jpg",
    "date": "8/25/24",
    "dateISO": "2024-08-25",
    "category": "Ssbbw",
    "keywords": "Weight Bench,Weight,Bounce,Bouncing,Ass,Hump,Humping",
    "duration": "11 Min",
    "description": "I got my hands on a weight bench to see if I could try a little humping action, but there was NOTHING little about all the jiggle and bounce happening in this video!",
    "watchUrl": "https://1drv.ms/v/c/56a0c4f446943249/IQQIdnxCxUoMRKrsHy4yeTDHAcHEmvf8KmlDrznD23vxzcM"
  },
  {
    "id": 130,
    "title": "Kiss and Feed",
    "image": "https://imagecdn.clips4sale.com/accounts99/135731/clip_images/previewlg_29176479.jpg",
    "date": "5/24/24",
    "dateISO": "2024-05-24",
    "category": "Ssbbw",
    "keywords": "Fat Rolls,Weight,Fat Admirer,Feeding,Eating,Stuffing",
    "duration": "10 Min",
    "description": "It's time to have fun doing some of my biggest turn ons. Steamy kisses, delicious treats, and a whole lot of fat on display! I have a hot make out session while being fed timbits, and felt up, which is exactly what I needed. I could do this all day and night, so don't leave me waiting <3",
    "watchUrl": "https://1drv.ms/v/c/56a0c4f446943249/IQSAsiyzxLjqT6cHKn3mHqFCAQIXcPU60QhRZRb3M8zHAas"
  },
  {
    "id": 129,
    "title": "Weigh-In April 2024",
    "image": "https://imagecdn.clips4sale.com/accounts99/135731/clip_images/previewlg_28981987.jpg",
    "date": "4/23/24",
    "dateISO": "2024-04-23",
    "category": "Ssbbw",
    "keywords": "Weigh In,Weigh-in,Weight,Scale",
    "duration": "10 Min",
    "description": "If you saw my last weigh-in, you know that a challenge was made for myself. I wonder if I met my goal, and if there's any progress, how much? I can't WAIT for you to find out!",
    "watchUrl": "https://1drv.ms/v/c/56a0c4f446943249/IQTtBb-anxrrSoKjeoZBnRdvAVu02RmlB6P9yzUXtDhGomY"
  },
  {
    "id": 128,
    "title": "Fuck My Fat",
    "image": "https://imagecdn.clips4sale.com/accounts99/135731/clip_images/previewlg_28557579.jpg",
    "date": "1/24/24",
    "dateISO": "2024-01-24",
    "category": "Ssbbw",
    "keywords": "Fat Rolls,Rolls,Fuck Rolls",
    "duration": "10 Min",
    "description": "I love the feeling of having my rolls, tits, and belly button fucked. Using my confetti cake style dildo, watch as I show you just what I like, and exactly where you can have endless fun with me.",
    "watchUrl": "https://1drv.ms/v/c/56a0c4f446943249/IQTPjFSq2SYDS5FU3q1gORqCAdep-wo-9MktOZFdCtEhLJc"
  },
  {
    "id": 127,
    "title": "Falling at the Airport Fat Chat",
    "image": "https://imagecdn.clips4sale.com/accounts99/135731/clip_images/previewlg_28392249.jpg",
    "date": "12/14/23",
    "dateISO": "2023-12-14",
    "category": "Ssbbw",
    "keywords": "Fat Chat,Fall,Airport,Story,Hurt,Chatting,Embarrassing",
    "duration": "11 Min",
    "description": "Nothing quite prepares you for falling while super fat, especially if it's in public. At least I can laugh about it and share my embarrassment with you while showing off my body.",
    "watchUrl": "https://1drv.ms/v/c/56a0c4f446943249/IQT0QNQUn5WsTqrCrpLwor_rAYdHRhWDK-5yFAJg5eamvtw"
  },
  {
    "id": 126,
    "title": "Weigh-In November 2023 and New Challenge",
    "image": "https://imagecdn.clips4sale.com/accounts99/135731/clip_images/previewlg_28301815.jpg",
    "date": "11/22/23",
    "dateISO": "2023-11-22",
    "category": "Ssbbw",
    "keywords": "Scale,Weight,Weight Gain,Weigh In,Weigh-in,Gaining",
    "duration": "11 Min",
    "description": "It's been a year since my last weigh-in, can you believe it?!\n\nA lot has happened in the last year, some good and some not so good, so I was genuinely unsure what I would see when I stepped on the scale.",
    "watchUrl": "https://1drv.ms/v/c/56a0c4f446943249/IQRZRgJRGsCZRIB3TyvuTszzAazx2n5_2JWBe4TOELxeMD4"
  },
  {
    "id": 125,
    "title": "Belly Hang Play",
    "image": "https://imagecdn.clips4sale.com/accounts99/135731/clip_images/previewlg_27833041.jpg",
    "date": "7/30/23",
    "dateISO": "2023-07-30",
    "category": "Ssbbw",
    "keywords": "Belly,Bed,Fat Rolls,Rolls,Hangs,Lay,Lay Down,Laying",
    "duration": "6 Min",
    "description": "It's a struggle to haul my huge body around on this bed, but I am excited to get on my hands and knees and show you just how much my belly hangs. It is so big it doesn't just hang, but presses into the bed even while I'm not laying down. It's fun to play with my hanging belly and make it slap against my thighs, as well as see how it squishes and makes huge rolls when I lay on my stomach.",
    "watchUrl": "https://1drv.ms/v/c/56a0c4f446943249/IQSsv7FBbgYPTaRAx5Fq8lDTAaAkxrVKoe6cxc3_u_IiFkM"
  },
  {
    "id": 124,
    "title": "Before Dinner Date",
    "image": "https://imagecdn.clips4sale.com/accounts99/135731/clip_images/previewlg_27832975.jpg",
    "date": "7/30/23",
    "dateISO": "2023-07-30",
    "category": "Ssbbw",
    "keywords": "Lotion,No Clothes",
    "duration": "7 Min",
    "description": "We're about to go out to dinner, but I still need to do a few things to get ready. One of those things is tease you by showing off my massive body, particularly my huge thighs and calves, and barely visible cankles. I can't wait to go out and stuff myself with your help. Imagine what the other people in the restaurant will think when they see us. They know you're just trying to make me fatter than I already am.",
    "watchUrl": "https://1drv.ms/v/c/56a0c4f446943249/IQQ5JyPZ2NqtSJvVBd_1hCCFAdyZRRmC_nyU_mJnG7v-MRU"
  },
  {
    "id": 123,
    "title": "Conditioning to Only want BBW and SSBBW with JOI",
    "image": "https://imagecdn.clips4sale.com/accounts99/135731/clip_images/previewlg_27540787.jpg",
    "date": "5/16/23",
    "dateISO": "2023-05-16",
    "category": "Ssbbw",
    "keywords": "Roleplay,Fat Admire,Desire,Conditioned",
    "duration": "8 Min",
    "description": "I know you desire bbw & ssbbw, and you have been trying to hide it. After today, everything will change. Just pay very close attention to me, listen carefully, and follow my instructions. Once I'm done with you, you'll be conditioned to only ever find bbw & ssbbw sexy. You won't be able to resist. Now grab your cock and show me just how devoted you are.",
    "watchUrl": "https://1drv.ms/v/c/56a0c4f446943249/IQQw6wp-LrwIRoJ_DWOkvFB8AdiRkg3Wc5_Q0snWI-aG9M0"
  },
  {
    "id": 122,
    "title": "Hummer and Pink Car Crush",
    "image": "https://imagecdn.clips4sale.com/accounts99/135731/clip_images/previewlg_27390395.jpg",
    "date": "4/6/23",
    "dateISO": "2023-04-06",
    "category": "Ssbbw",
    "keywords": "Car Crush,Waddle,Bratty,Spolied,Toy Car",
    "duration": "11 Min",
    "description": "I'm fat, bratty, spoiled, and in need of a bigger and more durable car to drive around for fun. The hummer was big by remote control car standards, but why doesn't it move when I sit on it!? Obviously this hunk of junk is destined for the dumpster, but maybe the big pink car I was promised will be able to handle me. If not, I better get an extra good present to make up for it!",
    "watchUrl": "https://1drv.ms/v/c/56a0c4f446943249/IQThypONBuiWRYhaqQVevsUyAQNXKDauU1dMA1uvKG27_mI"
  },
  {
    "id": 121,
    "title": "Making Shorts",
    "image": "https://imagecdn.clips4sale.com/accounts99/135731/clip_images/previewlg_27350349.jpg",
    "date": "3/27/23",
    "dateISO": "2023-03-27",
    "category": "Ssbbw",
    "keywords": "Clothes,Shorts,Clothing,Tight Clothes,Tight,Denim,Panties",
    "duration": "8 Min",
    "description": "Finding denim shorts that fit at my size feels nearly impossible. I decided to take an old pair of jeans and cut them into some cute shorts, but I forgot how much fatter I have become, and so while *technically* I made shorts, I think they ended up looking a lot more like denim panties. I couldn't even fit my belly inside!",
    "watchUrl": "https://1drv.ms/v/c/56a0c4f446943249/IQTSEEcJIUK1QKPwH8QnRRn3ASJ2hSvH8ypPzsH-jjXT6C0"
  },
  {
    "id": 120,
    "title": "Honey Glazed Delight",
    "image": "https://imagecdn.clips4sale.com/accounts99/135731/clip_images/previewlg_27225757.jpg",
    "date": "2/23/23",
    "dateISO": "2023-02-23",
    "category": "Ssbbw",
    "keywords": "Doughnut,Donut,Donuts",
    "duration": "9 Min",
    "description": "Got myself a sweet little treat with a box of donuts just for me! What is a perfect pairing for honey glazed crullers? Strawberry milk of course! Now usually I will casually eat 2-3 donuts at a time, but this is a box of 6, and it's my fav, so time to see if my bigger than ever belly comes with a bigger than ever appetite.",
    "watchUrl": "https://1drv.ms/v/c/56a0c4f446943249/IQRpr0hhiTYjS7SQh5vwE7v9Add1iT9PKA6a5Ssf7TpgSy0"
  }
]
